{
  "$schema": "../../../public/schemas/profile-schema.json",
  "name": "Zaú Júlio",
  "title": "Engenheiro de Software",
  "location": "Brasil (UTC-3)",
  "email": "zaujulio.dev@gmail.com",
  "website": "https://zaujulio.com",
  "social": {
    "github": "https://github.com/zaujulio",
    "linkedin": "https://linkedin.com/in/zaujulio"
  },
  "experience": [
    {
      "id": "1",
      "role": "Tech Lead",
      "company": "Bitwise Technology",
      "period": "Ago 2025 - Present",
      "location": "Sorocaba, SP - Remoto",
      "description": "Liderei os esforços de engenharia para construir soluções de software de alto desempenho. Definindo padrões técnicos, supervisionando o design de sistemas desde modelagem ER até orçamento e implantação de infraestrutura em nuvem.",
      "skills": ["Mentoria", "Design de Sistemas", "CI/CD", "Arquitetura em Nuvem"]
    },
    {
      "id": "2",
      "role": "Desenvolvedor Full Stack",
      "company": "Bitwise Technology",
      "period": "Mar 2023 - Present",
      "location": "Sorocaba, SP - Remoto",
      "description": "Projetei e desenvolvi várias aplicações web robustas em todo o ciclo de vida do software — do planejamento e arquitetura até implantação e otimização.",
      "skills": ["TypeScript", "GraphQL", "MongoDB", "React", "AWS", "Node.js"]
    },
    {
      "id": "3",
      "role": "Desenvolvedor Full Stack",
      "company": "Commcepta",
      "period": "Dez 2021 - Dez 2022",
      "location": "Curitiba, PR - Remoto",
      "description": "Trabalhei em projetos complexos envolvendo Big Data e GraphQL. Explorando insights em estruturas de dados em grafos, construindo um data lake em grande escala.",
      "skills": ["GraphQL", "Big Data", "React", "Data Lake"]
    },
    {
      "id": "4",
      "role": "Diretor de Projetos",
      "company": "Byte Serido Jr",
      "period": "Jun 2021 - Nov 2022",
      "location": "Caicó, RN - Híbrido",
      "description": "Comecei como Desenvolvedor Frontend, depois assumindo como Diretor de Projetos. Liderou o planejamento e execução de projetos de software.",
      "skills": ["Gestão de Projetos", "Design de Sistemas", "Frontend", "Liderança"]
    },
    {
      "id": "5",
      "role": "Assistente de Pesquisa",
      "company": "Universidade Federal do Rio Grande do Norte (UFRN)",
      "period": "Aug 2020 - Sept 2021",
      "location": "Caicó, RN - On-site",
      "description": "Atuei como Assistente de Iniciação Científica no LabEPI/UFRN em projetos focados na aplicação de Inteligência Artificial e Aprendizado de Máquina Não Supervisionado para gestão inteligente de energia. Construí pipelines de dados usando Python, R e Octave para ingerir e pré-processar dados de séries temporais.",
      "skills": ["Teaching", "Computer Networks", "Software Engineering", "Mentoring"]
    }
  ]
}
