{
  "$schema": "../../../../public/schemas/profile-schema.json",
  "name": "Zau Julio",
  "title": "Software Engineer",
  "location": "Brazil (UTC-3)",
  "email": "zaujulio.dev@gmail.com",
  "website": "https://zaujulio.vercel.app",
  "social": {
    "github": "https://github.com/zaujulio",
    "linkedin": "https://linkedin.com/in/zaujulio"
  },
  "experience": [
    {
      "id": "1",
      "role": "Tech Lead",
      "company": "Bitwise Technology",
      "period": "Aug 2025 - Present",
      "location": "Sorocaba, SP - Remote",
      "description": "Leading the engineering efforts to build high-performance software solutions. Defining technical standards, overseeing system design from ER modeling to cloud infrastructure budgeting and deployment.",
      "skills": ["Mentoring", "System Design", "CI/CD", "Cloud Architecture"]
    },
    {
      "id": "2",
      "role": "Full Stack Developer",
      "company": "Bitwise Technology",
      "period": "Mar 2023 - Present",
      "location": "Sorocaba, SP - Remote",
      "description": "Designing and developing robust web applications across the entire software lifecycle — from planning and architecture to deployment and optimization.",
      "skills": ["TypeScript", "GraphQL", "MongoDB", "React", "AWS", "Node.js"]
    },
    {
      "id": "3",
      "role": "Full Stack Developer",
      "company": "Commcepta",
      "period": "Dec 2021 - Dec 2022",
      "location": "Curitiba, PR - Remote",
      "description": "Handled complex projects involving Big Data and GraphQL. Explored hidden insights within graph data structures, building a large-scale data lake.",
      "skills": ["GraphQL", "Big Data", "React", "Data Lake"]
    },
    {
      "id": "4",
      "role": "Project Director",
      "company": "Byte Serido Jr",
      "period": "Jun 2021 - Nov 2022",
      "location": "Caico, RN - Hybrid",
      "description": "Started as a Frontend Developer, later taking on the role of Project Director. Led the planning and execution of software projects.",
      "skills": ["Project Management", "System Design", "Frontend", "Leadership"]
    },
    {
      "id": "5",
      "role": "Research Assistant",
      "company": "Federal University of Rio Grande do Norte (UFRN)",
      "period": "Aug 2020 - Sept 2021",
      "location": "Caicó, RN - On-site",
      "description": "Worked as an Undergraduate Research Assistant at LabEPI/UFRN on projects focused on applying Artificial Intelligence and Unsupervised Machine Learning for smart energy management. Built data pipelines using Python, R, and Octave to ingest and pre-process time-series data.",
      "skills": ["Teaching", "Computer Networks", "Software Engineering", "Mentoring"]
    }
  ],
  "thesis": {
    "title": "Features Analyzer",
    "subtitle": "Boilerplate for Data Visualization and Analysis Tools",
    "institution": "Federal University of Rio Grande do Norte (UFRN)",
    "year": "2024",
    "description": "A Python desktop application for dataset feature analysis, prototyping and testing machine learning and statistical models.",
    "technologies": [
      "Python",
      "GTK",
      "Pandas",
      "NumPy",
      "Scikit-learn",
      "Matplotlib",
      "Seaborn",
      "Pydantic",
      "TinyDB",
      "Docker",
      "i18n"
    ],
    "links": {
      "source": "https://github.com/ZauJulio/FeaturesAnalyzer",
      "documentation": "https://zaujulio.github.io/FeaturesAnalyzer/"
    }
  },
  "hobbies": ["Photography", "Cooking", "Music"]
}
